{
  "schema_version": "0.1",
  "file_id": "FA-4290_mensajería.pdf",
  "source_sha256": "8db9c19e0019bf5ffa38f9072549a4b041023cd53f63f4cfac05577474568403",
  "stage2": {
    "author": "Codex",
    "source": "codex_visual",
    "status": "draft",
    "reviewer": null,
    "reviewed_at": null,
    "artifact_sha256": "8be3e472fbc6e269d2ece883be90dacd34095ed7c22ddafc4fd889ffeedb6195",
    "complete": true,
    "inspected_pages": [
      1
    ],
    "excluded_pointers": []
  },
  "stage3": {
    "author": "Codex",
    "source": "codex_visual",
    "status": "draft",
    "reviewer": null,
    "reviewed_at": null,
    "artifact_sha256": "dafe593c965a91e6c30a2d0c0aa8f68adcf2b904db3ecc124ad66049912e1844",
    "complete": true,
    "inspected_pages": [
      1
    ],
    "excluded_pointers": []
  },
  "pointers": {
    "/annotations/0/kind": [
      {
        "page": 1,
        "reference_ids": [
          "p1-b015"
        ]
      }
    ],
    "/annotations/0/text": [
      {
        "page": 1,
        "reference_ids": [
          "p1-b015"
        ]
      }
    ],
    "/additional_fields/0/label": [
      {
        "page": 1,
        "reference_ids": [
          "p1-b015"
        ]
      }
    ],
    "/additional_fields/0/raw_value": [
      {
        "page": 1,
        "reference_ids": [
          "p1-b015"
        ]
      }
    ],
    "/annotations/1/kind": [
      {
        "page": 1,
        "reference_ids": [
          "p1-b016"
        ]
      }
    ],
    "/annotations/1/text": [
      {
        "page": 1,
        "reference_ids": [
          "p1-b016"
        ]
      }
    ],
    "/annotations/2/kind": [
      {
        "page": 1,
        "reference_ids": [
          "p1-b017"
        ]
      }
    ],
    "/annotations/2/text": [
      {
        "page": 1,
        "reference_ids": [
          "p1-b017"
        ]
      }
    ],
    "/annotations/3/kind": [
      {
        "page": 1,
        "reference_ids": [
          "p1-b018"
        ]
      }
    ],
    "/annotations/3/text": [
      {
        "page": 1,
        "reference_ids": [
          "p1-b018"
        ]
      }
    ],
    "/supplier/name": [
      {
        "page": 1,
        "reference_ids": [
          "p1-b001"
        ]
      }
    ],
    "/supplier/tax_id": [
      {
        "page": 1,
        "reference_ids": [
          "p1-b002"
        ]
      }
    ],
    "/supplier/location": [
      {
        "page": 1,
        "reference_ids": [
          "p1-b003"
        ]
      }
    ],
    "/payment/iban": [
      {
        "page": 1,
        "reference_ids": [
          "p1-b004"
        ]
      }
    ],
    "/invoice_number": [
      {
        "page": 1,
        "reference_ids": [
          "p1-b005"
        ]
      }
    ],
    "/issue_date": [
      {
        "page": 1,
        "reference_ids": [
          "p1-b006"
        ]
      }
    ],
    "/purchase_order_reference": [
      {
        "page": 1,
        "reference_ids": [
          "p1-b007"
        ]
      }
    ],
    "/customer/name": [
      {
        "page": 1,
        "reference_ids": [
          "p1-b008"
        ]
      }
    ],
    "/customer/tax_id": [
      {
        "page": 1,
        "reference_ids": [
          "p1-b008"
        ]
      }
    ],
    "/customer/address": [
      {
        "page": 1,
        "reference_ids": [
          "p1-b009"
        ]
      }
    ],
    "/customer/location": [
      {
        "page": 1,
        "reference_ids": [
          "p1-b009"
        ]
      }
    ],
    "/currency": [
      {
        "page": 1,
        "reference_ids": [
          "p1-b014"
        ]
      }
    ],
    "/lines/0/description": [
      {
        "page": 1,
        "reference_ids": [
          "p1-b010"
        ]
      }
    ],
    "/lines/0/quantity": [
      {
        "page": 1,
        "reference_ids": [
          "p1-b010"
        ]
      }
    ],
    "/lines/0/amount": [
      {
        "page": 1,
        "reference_ids": [
          "p1-b010"
        ]
      }
    ],
    "/lines/1/description": [
      {
        "page": 1,
        "reference_ids": [
          "p1-b011"
        ]
      }
    ],
    "/lines/1/quantity": [
      {
        "page": 1,
        "reference_ids": [
          "p1-b011"
        ]
      }
    ],
    "/lines/1/amount": [
      {
        "page": 1,
        "reference_ids": [
          "p1-b011"
        ]
      }
    ],
    "/totals/taxable_base": [
      {
        "page": 1,
        "reference_ids": [
          "p1-b012"
        ]
      }
    ],
    "/taxes/0/label": [
      {
        "page": 1,
        "reference_ids": [
          "p1-b013"
        ]
      }
    ],
    "/taxes/0/rate_percent": [
      {
        "page": 1,
        "reference_ids": [
          "p1-b013"
        ]
      }
    ],
    "/taxes/0/amount": [
      {
        "page": 1,
        "reference_ids": [
          "p1-b013"
        ]
      }
    ],
    "/totals/total": [
      {
        "page": 1,
        "reference_ids": [
          "p1-b014"
        ]
      }
    ]
  },
  "unresolved": []
}
