{
  "schema_version": "0.1",
  "file_id": "scan_007.pdf",
  "source_sha256": "208876a78ce72e7d6dc4acf842c6c96f38636fd9342fd92e9b1ec3ab5f6d2cf5",
  "stage2": {
    "author": "Codex",
    "source": "codex_visual",
    "status": "draft",
    "reviewer": null,
    "reviewed_at": null,
    "artifact_sha256": "fb0e3ceaab4965b5bd6902aed94604a82820f3811a0dca891d28c5d8f3ca9abc",
    "complete": true,
    "inspected_pages": [
      1
    ],
    "excluded_pointers": []
  },
  "stage3": {
    "author": "Codex",
    "source": "codex_visual",
    "status": "draft",
    "reviewer": null,
    "reviewed_at": null,
    "artifact_sha256": "e23d0c213f083befdb83144d743f61a38d52461e82dbe63178e01474a7b8bd16",
    "complete": true,
    "inspected_pages": [
      1
    ],
    "excluded_pointers": []
  },
  "pointers": {
    "/supplier/name": [
      {
        "page": 1,
        "reference_ids": [
          "p1-b001"
        ]
      }
    ],
    "/supplier/tax_id": [
      {
        "page": 1,
        "reference_ids": [
          "p1-b002"
        ]
      }
    ],
    "/payment/iban": [
      {
        "page": 1,
        "reference_ids": [
          "p1-b002"
        ]
      }
    ],
    "/invoice_number": [
      {
        "page": 1,
        "reference_ids": [
          "p1-b003"
        ]
      }
    ],
    "/issue_date": [
      {
        "page": 1,
        "reference_ids": [
          "p1-b003"
        ]
      }
    ],
    "/purchase_order_reference": [
      {
        "page": 1,
        "reference_ids": [
          "p1-b004"
        ]
      }
    ],
    "/customer/name": [
      {
        "page": 1,
        "reference_ids": [
          "p1-b005"
        ]
      }
    ],
    "/customer/tax_id": [
      {
        "page": 1,
        "reference_ids": [
          "p1-b005"
        ]
      }
    ],
    "/lines/0/description": [
      {
        "page": 1,
        "reference_ids": [
          "p1-b006"
        ]
      }
    ],
    "/lines/0/quantity": [
      {
        "page": 1,
        "reference_ids": [
          "p1-b006"
        ]
      }
    ],
    "/lines/0/amount": [
      {
        "page": 1,
        "reference_ids": [
          "p1-b006"
        ]
      }
    ],
    "/totals/taxable_base": [
      {
        "page": 1,
        "reference_ids": [
          "p1-b007"
        ]
      }
    ],
    "/taxes/0/label": [
      {
        "page": 1,
        "reference_ids": [
          "p1-b007"
        ]
      }
    ],
    "/taxes/0/rate_percent": [
      {
        "page": 1,
        "reference_ids": [
          "p1-b007"
        ]
      }
    ],
    "/taxes/0/amount": [
      {
        "page": 1,
        "reference_ids": [
          "p1-b007"
        ]
      }
    ],
    "/totals/total": [
      {
        "page": 1,
        "reference_ids": [
          "p1-b008"
        ]
      }
    ],
    "/currency": [
      {
        "page": 1,
        "reference_ids": [
          "p1-b008"
        ]
      }
    ]
  },
  "unresolved": [
    "Every region inspected visually. No values borrowed from other invoices or filenames. U+FFFD marks a damaged glyph explicitly described in uncertainties."
  ]
}
