{
  "schema_version": "0.1",
  "file_id": "2026-01-12_P010.pdf",
  "source_sha256": "02fc01d5b3bd10f1de1c3e5cbc8937ff9394729594588d384573e22ed4b0d2dd",
  "stage2": {
    "author": "Codex",
    "source": "codex_visual",
    "status": "draft",
    "reviewer": null,
    "reviewed_at": null,
    "artifact_sha256": "64d338c2e937647400bf247eaf2f360d6cd32cdaa118b534e9fe57269e3c24e7",
    "complete": true,
    "inspected_pages": [
      1
    ],
    "excluded_pointers": []
  },
  "stage3": {
    "author": "Codex",
    "source": "codex_visual",
    "status": "draft",
    "reviewer": null,
    "reviewed_at": null,
    "artifact_sha256": "3b8b8794e3ddc1add109e8120064f1afc12e666d4301f3f8380ec3a20c7b6d02",
    "complete": true,
    "inspected_pages": [
      1
    ],
    "excluded_pointers": []
  },
  "pointers": {
    "/annotations/0/kind": [
      {
        "page": 1,
        "reference_ids": [
          "p1-b012"
        ]
      }
    ],
    "/annotations/0/text": [
      {
        "page": 1,
        "reference_ids": [
          "p1-b012"
        ]
      }
    ],
    "/supplier/name": [
      {
        "page": 1,
        "reference_ids": [
          "p1-b004"
        ]
      }
    ],
    "/invoice_number": [
      {
        "page": 1,
        "reference_ids": [
          "p1-b002"
        ]
      }
    ],
    "/issue_date": [
      {
        "page": 1,
        "reference_ids": [
          "p1-b002"
        ]
      }
    ],
    "/purchase_order_reference": [
      {
        "page": 1,
        "reference_ids": [
          "p1-b003"
        ]
      }
    ],
    "/supplier/tax_id": [
      {
        "page": 1,
        "reference_ids": [
          "p1-b005"
        ]
      }
    ],
    "/payment/iban": [
      {
        "page": 1,
        "reference_ids": [
          "p1-b006"
        ]
      }
    ],
    "/customer/name": [
      {
        "page": 1,
        "reference_ids": [
          "p1-b007"
        ]
      }
    ],
    "/customer/tax_id": [
      {
        "page": 1,
        "reference_ids": [
          "p1-b007"
        ]
      }
    ],
    "/lines/0/description": [
      {
        "page": 1,
        "reference_ids": [
          "p1-b008"
        ]
      }
    ],
    "/lines/0/quantity": [
      {
        "page": 1,
        "reference_ids": [
          "p1-b008"
        ]
      }
    ],
    "/lines/0/amount": [
      {
        "page": 1,
        "reference_ids": [
          "p1-b008"
        ]
      }
    ],
    "/totals/taxable_base": [
      {
        "page": 1,
        "reference_ids": [
          "p1-b009"
        ]
      }
    ],
    "/taxes/0/label": [
      {
        "page": 1,
        "reference_ids": [
          "p1-b010"
        ]
      }
    ],
    "/taxes/0/rate_percent": [
      {
        "page": 1,
        "reference_ids": [
          "p1-b010"
        ]
      }
    ],
    "/taxes/0/amount": [
      {
        "page": 1,
        "reference_ids": [
          "p1-b010"
        ]
      }
    ],
    "/totals/total": [
      {
        "page": 1,
        "reference_ids": [
          "p1-b011"
        ]
      }
    ]
  },
  "unresolved": [
    "/issue_date: ambiguous (12/01/2026)"
  ]
}
