{
  "schema_version": "0.1",
  "file_id": "scan_023.pdf",
  "source_sha256": "06a1a3d6ff1a545e7d171b850e99107d6ff37d5fd72152ba2c5ca5e5d8a85fbc",
  "stage2": {
    "author": "Codex",
    "source": "codex_visual",
    "status": "draft",
    "reviewer": null,
    "reviewed_at": null,
    "artifact_sha256": "210a9988ebebeb1f00e2579d2dd7bda8b67cc90acb68ef7866716b9bff6b0d08",
    "complete": true,
    "inspected_pages": [
      1
    ],
    "excluded_pointers": []
  },
  "stage3": {
    "author": "Codex",
    "source": "codex_visual",
    "status": "draft",
    "reviewer": null,
    "reviewed_at": null,
    "artifact_sha256": "91b917e07173b6ea0371c6a9ad208f1d914d1de7a344b0494ef640a023380266",
    "complete": true,
    "inspected_pages": [
      1
    ],
    "excluded_pointers": []
  },
  "pointers": {
    "/supplier/name": [
      {
        "page": 1,
        "reference_ids": [
          "p1-b001"
        ]
      }
    ],
    "/supplier/tax_id": [
      {
        "page": 1,
        "reference_ids": [
          "p1-b002"
        ]
      }
    ],
    "/supplier/location": [
      {
        "page": 1,
        "reference_ids": [
          "p1-b002"
        ]
      }
    ],
    "/payment/iban": [
      {
        "page": 1,
        "reference_ids": [
          "p1-b003"
        ]
      }
    ],
    "/invoice_number": [
      {
        "page": 1,
        "reference_ids": [
          "p1-b004"
        ]
      }
    ],
    "/issue_date": [
      {
        "page": 1,
        "reference_ids": [
          "p1-b005"
        ]
      }
    ],
    "/purchase_order_reference": [
      {
        "page": 1,
        "reference_ids": [
          "p1-b006"
        ]
      }
    ],
    "/customer/name": [
      {
        "page": 1,
        "reference_ids": [
          "p1-b007"
        ]
      }
    ],
    "/customer/tax_id": [
      {
        "page": 1,
        "reference_ids": [
          "p1-b007"
        ]
      }
    ],
    "/lines/0/description": [
      {
        "page": 1,
        "reference_ids": [
          "p1-b008-r01-c1"
        ]
      }
    ],
    "/lines/0/quantity": [
      {
        "page": 1,
        "reference_ids": [
          "p1-b008-r01"
        ]
      }
    ],
    "/lines/0/amount": [
      {
        "page": 1,
        "reference_ids": [
          "p1-b008-r01-c2"
        ]
      }
    ],
    "/lines/1/description": [
      {
        "page": 1,
        "reference_ids": [
          "p1-b008-r02-c1"
        ]
      }
    ],
    "/lines/1/quantity": [
      {
        "page": 1,
        "reference_ids": [
          "p1-b008-r02"
        ]
      }
    ],
    "/lines/1/amount": [
      {
        "page": 1,
        "reference_ids": [
          "p1-b008-r02-c2"
        ]
      }
    ],
    "/lines/2/description": [
      {
        "page": 1,
        "reference_ids": [
          "p1-b008-r03-c1"
        ]
      }
    ],
    "/lines/2/quantity": [
      {
        "page": 1,
        "reference_ids": [
          "p1-b008-r03"
        ]
      }
    ],
    "/lines/2/amount": [
      {
        "page": 1,
        "reference_ids": [
          "p1-b008-r03-c2"
        ]
      }
    ],
    "/totals/taxable_base": [
      {
        "page": 1,
        "reference_ids": [
          "p1-b011"
        ]
      }
    ],
    "/taxes/0/label": [
      {
        "page": 1,
        "reference_ids": [
          "p1-b012"
        ]
      }
    ],
    "/taxes/0/rate_percent": [
      {
        "page": 1,
        "reference_ids": [
          "p1-b012"
        ]
      }
    ],
    "/taxes/0/amount": [
      {
        "page": 1,
        "reference_ids": [
          "p1-b012"
        ]
      }
    ],
    "/totals/total": [
      {
        "page": 1,
        "reference_ids": [
          "p1-b013"
        ]
      }
    ],
    "/currency": [
      {
        "page": 1,
        "reference_ids": [
          "p1-b013"
        ]
      }
    ],
    "/annotations/0/kind": [
      {
        "page": 1,
        "reference_ids": [
          "p1-b014"
        ]
      }
    ],
    "/annotations/0/text": [
      {
        "page": 1,
        "reference_ids": [
          "p1-b014"
        ]
      }
    ],
    "/annotations/1/kind": [
      {
        "page": 1,
        "reference_ids": [
          "p1-b015"
        ]
      }
    ],
    "/annotations/1/text": [
      {
        "page": 1,
        "reference_ids": [
          "p1-b015"
        ]
      }
    ],
    "/annotations/2/kind": [
      {
        "page": 1,
        "reference_ids": [
          "p1-b016"
        ]
      }
    ],
    "/annotations/2/text": [
      {
        "page": 1,
        "reference_ids": [
          "p1-b016"
        ]
      }
    ]
  },
  "unresolved": [
    "Every region inspected visually. No values borrowed from other invoices or filenames. U+FFFD marks a damaged glyph explicitly described in uncertainties.",
    "/annotations/2/text: unreadable (Informática Benimámet S.L.\nFACTURA Nº\nTOTAL)",
    "/supplier/tax_id: unreadable (B96233419)",
    "/payment/iban: unreadable (ES1800815290070001234567)",
    "/annotations/0/text: unreadable (Documento generado por el sistema de facturacion del proveedor.)"
  ]
}
