{
  "schema_version": "0.1",
  "file_id": "FA-4385_informática.pdf",
  "source_sha256": "55893528976075bbf31296f2f6df6883707e037f02896f28d038b117809c8186",
  "stage2": {
    "author": "Codex",
    "source": "codex_visual",
    "status": "draft",
    "reviewer": null,
    "reviewed_at": null,
    "artifact_sha256": "54a4a3b01724a5f516b0f9b951b6470fa6c219001c8811a6e60d272f5c4af451",
    "complete": true,
    "inspected_pages": [
      1
    ],
    "excluded_pointers": []
  },
  "stage3": {
    "author": "Codex",
    "source": "codex_visual",
    "status": "draft",
    "reviewer": null,
    "reviewed_at": null,
    "artifact_sha256": "54fd413c302c02a46cd2abe3e01f4c1de1f666a191def50a1b618785d8691af5",
    "complete": true,
    "inspected_pages": [
      1
    ],
    "excluded_pointers": []
  },
  "pointers": {
    "/annotations/0/kind": [
      {
        "page": 1,
        "reference_ids": [
          "p1-b012"
        ]
      }
    ],
    "/annotations/0/text": [
      {
        "page": 1,
        "reference_ids": [
          "p1-b012"
        ]
      }
    ],
    "/supplier/name": [
      {
        "page": 1,
        "reference_ids": [
          "p1-b001"
        ]
      }
    ],
    "/supplier/tax_id": [
      {
        "page": 1,
        "reference_ids": [
          "p1-b002"
        ]
      }
    ],
    "/supplier/location": [
      {
        "page": 1,
        "reference_ids": [
          "p1-b002"
        ]
      }
    ],
    "/payment/iban": [
      {
        "page": 1,
        "reference_ids": [
          "p1-b003"
        ]
      }
    ],
    "/invoice_number": [
      {
        "page": 1,
        "reference_ids": [
          "p1-b004"
        ]
      }
    ],
    "/issue_date": [
      {
        "page": 1,
        "reference_ids": [
          "p1-b005"
        ]
      }
    ],
    "/purchase_order_reference": [
      {
        "page": 1,
        "reference_ids": [
          "p1-b005"
        ]
      }
    ],
    "/customer/name": [
      {
        "page": 1,
        "reference_ids": [
          "p1-b006"
        ]
      }
    ],
    "/customer/tax_id": [
      {
        "page": 1,
        "reference_ids": [
          "p1-b006"
        ]
      }
    ],
    "/currency": [
      {
        "page": 1,
        "reference_ids": [
          "p1-b011"
        ]
      }
    ],
    "/lines/0/description": [
      {
        "page": 1,
        "reference_ids": [
          "p1-b007"
        ]
      }
    ],
    "/lines/0/quantity": [
      {
        "page": 1,
        "reference_ids": [
          "p1-b007"
        ]
      }
    ],
    "/lines/0/amount": [
      {
        "page": 1,
        "reference_ids": [
          "p1-b007"
        ]
      }
    ],
    "/lines/1/description": [
      {
        "page": 1,
        "reference_ids": [
          "p1-b008"
        ]
      }
    ],
    "/lines/1/quantity": [
      {
        "page": 1,
        "reference_ids": [
          "p1-b008"
        ]
      }
    ],
    "/lines/1/amount": [
      {
        "page": 1,
        "reference_ids": [
          "p1-b008"
        ]
      }
    ],
    "/totals/taxable_base": [
      {
        "page": 1,
        "reference_ids": [
          "p1-b009"
        ]
      }
    ],
    "/taxes/0/label": [
      {
        "page": 1,
        "reference_ids": [
          "p1-b010"
        ]
      }
    ],
    "/taxes/0/rate_percent": [
      {
        "page": 1,
        "reference_ids": [
          "p1-b010"
        ]
      }
    ],
    "/taxes/0/amount": [
      {
        "page": 1,
        "reference_ids": [
          "p1-b010"
        ]
      }
    ],
    "/totals/total": [
      {
        "page": 1,
        "reference_ids": [
          "p1-b011"
        ]
      }
    ]
  },
  "unresolved": []
}
