{
  "schema_version": "0.1",
  "file_id": "scan_017.pdf",
  "source_sha256": "a612f1df981f7967156aaf58ae25bd1a43fc6b3ca285e5d7522efc796a43df5a",
  "stage2": {
    "author": "Codex",
    "source": "codex_visual",
    "status": "draft",
    "reviewer": null,
    "reviewed_at": null,
    "artifact_sha256": "a2b5bfa25e20b4731dfa5494614c662465395e7abb1042e7079551a07bc0d1f6",
    "complete": true,
    "inspected_pages": [
      1
    ],
    "excluded_pointers": []
  },
  "stage3": {
    "author": "Codex",
    "source": "codex_visual",
    "status": "draft",
    "reviewer": null,
    "reviewed_at": null,
    "artifact_sha256": "41a9707d77ac88634a4775f1f96c39d0868832e0c412804e83540eeccd2c5fbf",
    "complete": true,
    "inspected_pages": [
      1
    ],
    "excluded_pointers": []
  },
  "pointers": {
    "/supplier/name": [
      {
        "page": 1,
        "reference_ids": [
          "p1-b001"
        ]
      }
    ],
    "/supplier/tax_id": [
      {
        "page": 1,
        "reference_ids": [
          "p1-b002"
        ]
      }
    ],
    "/supplier/location": [
      {
        "page": 1,
        "reference_ids": [
          "p1-b002"
        ]
      }
    ],
    "/payment/iban": [
      {
        "page": 1,
        "reference_ids": [
          "p1-b003"
        ]
      }
    ],
    "/invoice_number": [
      {
        "page": 1,
        "reference_ids": [
          "p1-b004"
        ]
      }
    ],
    "/issue_date": [
      {
        "page": 1,
        "reference_ids": [
          "p1-b005"
        ]
      }
    ],
    "/purchase_order_reference": [
      {
        "page": 1,
        "reference_ids": [
          "p1-b006"
        ]
      }
    ],
    "/customer/name": [
      {
        "page": 1,
        "reference_ids": [
          "p1-b007"
        ]
      }
    ],
    "/customer/tax_id": [
      {
        "page": 1,
        "reference_ids": [
          "p1-b007"
        ]
      }
    ],
    "/lines/0/description": [
      {
        "page": 1,
        "reference_ids": [
          "p1-b008-r01-c1"
        ]
      }
    ],
    "/lines/0/quantity": [
      {
        "page": 1,
        "reference_ids": [
          "p1-b008-r01"
        ]
      }
    ],
    "/lines/0/amount": [
      {
        "page": 1,
        "reference_ids": [
          "p1-b008-r01-c2"
        ]
      }
    ],
    "/lines/1/description": [
      {
        "page": 1,
        "reference_ids": [
          "p1-b008-r02-c1"
        ]
      }
    ],
    "/lines/1/quantity": [
      {
        "page": 1,
        "reference_ids": [
          "p1-b008-r02"
        ]
      }
    ],
    "/lines/1/amount": [
      {
        "page": 1,
        "reference_ids": [
          "p1-b008-r02-c2"
        ]
      }
    ],
    "/totals/taxable_base": [
      {
        "page": 1,
        "reference_ids": [
          "p1-b010"
        ]
      }
    ],
    "/taxes/0/label": [
      {
        "page": 1,
        "reference_ids": [
          "p1-b011"
        ]
      }
    ],
    "/taxes/0/rate_percent": [
      {
        "page": 1,
        "reference_ids": [
          "p1-b011"
        ]
      }
    ],
    "/taxes/0/amount": [
      {
        "page": 1,
        "reference_ids": [
          "p1-b011"
        ]
      }
    ],
    "/totals/total": [
      {
        "page": 1,
        "reference_ids": [
          "p1-b012"
        ]
      }
    ],
    "/currency": [
      {
        "page": 1,
        "reference_ids": [
          "p1-b012"
        ]
      }
    ],
    "/annotations/0/kind": [
      {
        "page": 1,
        "reference_ids": [
          "p1-b013"
        ]
      }
    ],
    "/annotations/0/text": [
      {
        "page": 1,
        "reference_ids": [
          "p1-b013"
        ]
      }
    ]
  },
  "unresolved": [
    "Every region inspected visually. No values borrowed from other invoices or filenames. U+FFFD marks a damaged glyph explicitly described in uncertainties.",
    "/issue_date: ambiguous (04/03/2026)",
    "/payment/iban: unreadable (ES2100491500051234567890)",
    "/supplier/tax_id: unreadable (B46102331)",
    "/issue_date: unreadable (None)",
    "/annotations/0/text: unreadable (Documento generado por el sistema de facturacion del proveedor.)"
  ]
}
