{
  "schema_version": "0.1",
  "file_id": "FA-5044_mensajería2.pdf",
  "source_sha256": "f9968fa529fc84b8f0d79f670e239646caa2aec6ba3bb0677e35d87b66472d7e",
  "stage2": {
    "author": "Codex",
    "source": "codex_visual",
    "status": "draft",
    "reviewer": null,
    "reviewed_at": null,
    "artifact_sha256": "55c2ac43bc0ece6f169ba7912dfb58932eaa810d3c33a0951c825d8100a9edca",
    "complete": true,
    "inspected_pages": [
      1
    ],
    "excluded_pointers": []
  },
  "stage3": {
    "author": "Codex",
    "source": "codex_visual",
    "status": "draft",
    "reviewer": null,
    "reviewed_at": null,
    "artifact_sha256": "0f0a099eec9b1653a3cdf1795a95d0da1cb80832ac86b6b801f21f9d36e56595",
    "complete": true,
    "inspected_pages": [
      1
    ],
    "excluded_pointers": []
  },
  "pointers": {
    "/annotations/0/kind": [
      {
        "page": 1,
        "reference_ids": [
          "p1-b015"
        ]
      }
    ],
    "/annotations/0/text": [
      {
        "page": 1,
        "reference_ids": [
          "p1-b015"
        ]
      }
    ],
    "/supplier/name": [
      {
        "page": 1,
        "reference_ids": [
          "p1-b001"
        ]
      }
    ],
    "/supplier/tax_id": [
      {
        "page": 1,
        "reference_ids": [
          "p1-b002"
        ]
      }
    ],
    "/supplier/location": [
      {
        "page": 1,
        "reference_ids": [
          "p1-b003"
        ]
      }
    ],
    "/payment/iban": [
      {
        "page": 1,
        "reference_ids": [
          "p1-b004"
        ]
      }
    ],
    "/invoice_number": [
      {
        "page": 1,
        "reference_ids": [
          "p1-b005"
        ]
      }
    ],
    "/issue_date": [
      {
        "page": 1,
        "reference_ids": [
          "p1-b006"
        ]
      }
    ],
    "/purchase_order_reference": [
      {
        "page": 1,
        "reference_ids": [
          "p1-b007"
        ]
      }
    ],
    "/customer/name": [
      {
        "page": 1,
        "reference_ids": [
          "p1-b008"
        ]
      }
    ],
    "/customer/tax_id": [
      {
        "page": 1,
        "reference_ids": [
          "p1-b008"
        ]
      }
    ],
    "/customer/address": [
      {
        "page": 1,
        "reference_ids": [
          "p1-b009"
        ]
      }
    ],
    "/customer/location": [
      {
        "page": 1,
        "reference_ids": [
          "p1-b009"
        ]
      }
    ],
    "/currency": [
      {
        "page": 1,
        "reference_ids": [
          "p1-b014"
        ]
      }
    ],
    "/lines/0/description": [
      {
        "page": 1,
        "reference_ids": [
          "p1-b010"
        ]
      }
    ],
    "/lines/0/quantity": [
      {
        "page": 1,
        "reference_ids": [
          "p1-b010"
        ]
      }
    ],
    "/lines/0/amount": [
      {
        "page": 1,
        "reference_ids": [
          "p1-b010"
        ]
      }
    ],
    "/lines/1/description": [
      {
        "page": 1,
        "reference_ids": [
          "p1-b011"
        ]
      }
    ],
    "/lines/1/quantity": [
      {
        "page": 1,
        "reference_ids": [
          "p1-b011"
        ]
      }
    ],
    "/lines/1/amount": [
      {
        "page": 1,
        "reference_ids": [
          "p1-b011"
        ]
      }
    ],
    "/totals/taxable_base": [
      {
        "page": 1,
        "reference_ids": [
          "p1-b012"
        ]
      }
    ],
    "/taxes/0/label": [
      {
        "page": 1,
        "reference_ids": [
          "p1-b013"
        ]
      }
    ],
    "/taxes/0/rate_percent": [
      {
        "page": 1,
        "reference_ids": [
          "p1-b013"
        ]
      }
    ],
    "/taxes/0/amount": [
      {
        "page": 1,
        "reference_ids": [
          "p1-b013"
        ]
      }
    ],
    "/totals/total": [
      {
        "page": 1,
        "reference_ids": [
          "p1-b014"
        ]
      }
    ]
  },
  "unresolved": [
    "Embedded text contains an invisible ATENCION AGENTE paragraph. Not visible on rendered white page; excluded from visual reference. Human reviewer should confirm visibility policy.",
    "/issue_date: ambiguous (08/05/2026)"
  ]
}
