{
  "schema_version": "0.1",
  "file_id": "scan_025.pdf",
  "source_sha256": "7c20bd53318f9e8c80258bcf19807bbde07ed73e81ce8824bfaabe5f070cfb15",
  "stage2": {
    "author": "Codex",
    "source": "codex_visual",
    "status": "draft",
    "reviewer": null,
    "reviewed_at": null,
    "artifact_sha256": "e6db7713ac28ddd0fa4605284c057df936c53ab41e572025eaaad3f3cf135bdb",
    "complete": true,
    "inspected_pages": [
      1
    ],
    "excluded_pointers": []
  },
  "stage3": {
    "author": "Codex",
    "source": "codex_visual",
    "status": "draft",
    "reviewer": null,
    "reviewed_at": null,
    "artifact_sha256": "2dede7efe2316383897c0a0ef85e3b51ddf8df682054ed12918411fbf3f6f3f5",
    "complete": true,
    "inspected_pages": [
      1
    ],
    "excluded_pointers": []
  },
  "pointers": {
    "/supplier/name": [
      {
        "page": 1,
        "reference_ids": [
          "p1-b001"
        ]
      }
    ],
    "/supplier/tax_id": [
      {
        "page": 1,
        "reference_ids": [
          "p1-b002"
        ]
      }
    ],
    "/supplier/location": [
      {
        "page": 1,
        "reference_ids": [
          "p1-b002"
        ]
      }
    ],
    "/payment/iban": [
      {
        "page": 1,
        "reference_ids": [
          "p1-b003"
        ]
      }
    ],
    "/invoice_number": [
      {
        "page": 1,
        "reference_ids": [
          "p1-b004"
        ]
      }
    ],
    "/issue_date": [
      {
        "page": 1,
        "reference_ids": [
          "p1-b005"
        ]
      }
    ],
    "/purchase_order_reference": [
      {
        "page": 1,
        "reference_ids": [
          "p1-b006"
        ]
      }
    ],
    "/customer/name": [
      {
        "page": 1,
        "reference_ids": [
          "p1-b007"
        ]
      }
    ],
    "/customer/tax_id": [
      {
        "page": 1,
        "reference_ids": [
          "p1-b007"
        ]
      }
    ],
    "/lines/0/description": [
      {
        "page": 1,
        "reference_ids": [
          "p1-b008-r01-c1"
        ]
      }
    ],
    "/lines/0/quantity": [
      {
        "page": 1,
        "reference_ids": [
          "p1-b008-r01"
        ]
      }
    ],
    "/lines/0/amount": [
      {
        "page": 1,
        "reference_ids": [
          "p1-b008-r01-c2"
        ]
      }
    ],
    "/lines/1/description": [
      {
        "page": 1,
        "reference_ids": [
          "p1-b008-r02-c1"
        ]
      }
    ],
    "/lines/1/quantity": [
      {
        "page": 1,
        "reference_ids": [
          "p1-b008-r02"
        ]
      }
    ],
    "/lines/1/amount": [
      {
        "page": 1,
        "reference_ids": [
          "p1-b008-r02-c2"
        ]
      }
    ],
    "/totals/taxable_base": [
      {
        "page": 1,
        "reference_ids": [
          "p1-b010"
        ]
      }
    ],
    "/taxes/0/label": [
      {
        "page": 1,
        "reference_ids": [
          "p1-b011"
        ]
      }
    ],
    "/taxes/0/rate_percent": [
      {
        "page": 1,
        "reference_ids": [
          "p1-b011"
        ]
      }
    ],
    "/taxes/0/amount": [
      {
        "page": 1,
        "reference_ids": [
          "p1-b011"
        ]
      }
    ],
    "/totals/total": [
      {
        "page": 1,
        "reference_ids": [
          "p1-b012"
        ]
      }
    ],
    "/currency": [
      {
        "page": 1,
        "reference_ids": [
          "p1-b012"
        ]
      }
    ],
    "/annotations/0/kind": [
      {
        "page": 1,
        "reference_ids": [
          "p1-b013"
        ]
      }
    ],
    "/annotations/0/text": [
      {
        "page": 1,
        "reference_ids": [
          "p1-b013"
        ]
      }
    ],
    "/annotations/1/kind": [
      {
        "page": 1,
        "reference_ids": [
          "p1-b014"
        ]
      }
    ],
    "/annotations/1/text": [
      {
        "page": 1,
        "reference_ids": [
          "p1-b014"
        ]
      }
    ]
  },
  "unresolved": [
    "Every region inspected visually. No values borrowed from other invoices or filenames. U+FFFD marks a damaged glyph explicitly described in uncertainties.",
    "/annotations/1/text: unreadable (Electricidad Montcada S.A.\nNIF: A46990201 · Valencia\nCuenta de abono (IBAN): ES35 2038 5778 9830 0076 5410\nFACTURA Nº F26-2203\nFecha: 07/06/2026\nPedido: PO-2026-0720\nCliente: Banco Miralmar S.A. · CIF: A58231074\nServicio mensual 1.040,00\nMantenimiento trimestral 1.040,00\nSuministro pedido 1.040,00\nBase imponible 3.120,00\nIVA 21% 655,20\nTOTAL 3.775,20 EUR\nURGENTE\nDocumento generado por el sistema de facturacion del proveedor.)"
  ]
}
